root@lamp-ubuntu-s-1vcpu-1gb-tor1-01:~# tcpdump -r 0001.pcap
reading from file 0001.pcap, link-type EN10MB (Ethernet)
20:31:12.843924 IP 165.227.37.88.ssh > 97.109.27.104.50034: Flags [P.], seq 287778193:287778237, ack 589355900, win 501, length 44
20:31:12.844022 IP 165.227.37.88.ssh > 97.109.27.104.50034: Flags [P.], seq 44:152, ack 1, win 501, length 108
20:31:12.844069 IP 165.227.37.88.ssh > 97.109.27.104.50034: Flags [P.], seq 152:188, ack 1, win 501, length 36
20:31:12.870847 IP 97.109.27.104.50034 > 165.227.37.88.ssh: Flags [.], ack 152, win 514, length 0
20:31:12.870884 IP 97.109.27.104.50034 > 165.227.37.88.ssh: Flags [.], ack 188, win 513, length 0
20:31:15.948053 IP 159.65.200.203.46892 > 165.227.37.88.mdns: 0 PTR (QU)? _psia._tcp.local. (34)
20:31:16.190690 IP 106.13.20.31.38808 > 165.227.37.88.ssh: Flags [S], seq 3936133306, win 29200, options [mss 1460,sackOK,TS val 2681579908 ecr 0,nop,wscale 7], length 0
20:31:16.190741 IP 165.227.37.88 > 106.13.20.31: ICMP 165.227.37.88 tcp port ssh unreachable, length 68
20:31:18.674987 IP net6-ip210.linkbg.com.51020 > 165.227.37.88.submissions: Flags [S], seq 2734283473, win 29200, options [mss 1460,sackOK,TS val 4176600505 ecr 0,nop,wscale 7], length 0
20:31:19.732232 IP net6-ip210.linkbg.com.51020 > 165.227.37.88.submissions: Flags [S], seq 2734283473, win 29200, options [mss 1460,sackOK,TS val 4176601560 ecr 0,nop,wscale 7], length 0
20:31:21.777435 IP net6-ip210.linkbg.com.51020 > 165.227.37.88.submissions: Flags [S], seq 2734283473, win 29200, options [mss 1460,sackOK,TS val 4176603607 ecr 0,nop,wscale 7], length 0
20:31:24.707450 IP 194.147.140.52.49931 > 165.227.37.88.4590: Flags [S], seq 4271703437, win 1024, length 0
20:31:25.808044 IP net6-ip210.linkbg.com.51020 > 165.227.37.88.submissions: Flags [S], seq 2734283473, win 29200, options [mss 1460,sackOK,TS val 4176607638 ecr 0,nop,wscale 7], length 0
20:31:27.193319 IP 165.227.37.88.http > li606-228.members.linode.com.domain: Flags [S.], seq 2814290978, ack 1426345791, win 64240, options [mss 1460], length 0
20:31:34.072138 IP net6-ip210.linkbg.com.51020 > 165.227.37.88.submissions: Flags [S], seq 2734283473, win 29200, options [mss 1460,sackOK,TS val 4176615895 ecr 0,nop,wscale 7], length 0
20:31:46.033305 IP 49.88.112.73.11372 > 165.227.37.88.ssh: Flags [S], seq 3400062683, win 29200, options [mss 1460,sackOK,TS val 542614102 ecr 0,nop,wscale 7], length 0
20:31:46.033366 IP 165.227.37.88.ssh > 49.88.112.73.11372: Flags [S.], seq 3674270705, ack 3400062684, win 65160, options [mss 1460,sackOK,TS val 1952034544 ecr 542614102,nop,wscale 7], length 0
20:31:47.029859 IP 49.88.112.73.11372 > 165.227.37.88.ssh: Flags [S], seq 3400062683, win 29200, options [mss 1460,sackOK,TS val 542614352 ecr 0,nop,wscale 7], length 0
20:31:47.029922 IP 165.227.37.88.ssh > 49.88.112.73.11372: Flags [S.], seq 3674270705, ack 3400062684, win 65160, options [mss 1460,sackOK,TS val 1952035541 ecr 542614102,nop,wscale 7], length 0
20:31:47.253051 IP 49.88.112.73.11372 > 165.227.37.88.ssh: Flags [.], ack 1, win 229, options [nop,nop,TS val 542614407 ecr 1952035541], length 0
20:31:47.253110 IP 49.88.112.73.11372 > 165.227.37.88.ssh: Flags [P.], seq 1:16, ack 1, win 229, options [nop,nop,TS val 542614407 ecr 1952035541], length 15
20:31:47.263526 IP 165.227.37.88.ssh > 49.88.112.73.11372: Flags [P.], seq 1:42, ack 1, win 510, options [nop,nop,TS val 1952035774 ecr 542614407], length 41
20:31:47.486511 IP 49.88.112.73.11372 > 165.227.37.88.ssh: Flags [.], ack 42, win 229, options [nop,nop,TS val 542614466 ecr 1952035774], length 0
20:31:48.302487 IP 97.109.27.104.50034 > 165.227.37.88.ssh: Flags [P.], seq 1:45, ack 188, win 513, length 44
20:31:48.302539 IP 165.227.37.88.ssh > 97.109.27.104.50034: Flags [.], ack 45, win 501, length 0
20:31:48.302706 IP 165.227.37.88.ssh > 97.109.27.104.50034: Flags [P.], seq 188:232, ack 45, win 501, length 44
20:31:48.370068 IP 97.109.27.104.50034 > 165.227.37.88.ssh: Flags [.], ack 232, win 513, length 0
20:31:49.018839 IP 97.109.27.104.50034 > 165.227.37.88.ssh: Flags [P.], seq 45:89, ack 232, win 513, length 44
20:31:49.019049 IP 165.227.37.88.ssh > 97.109.27.104.50034: Flags [P.], seq 232:276, ack 89, win 501, length 44
20:31:49.079811 IP 97.109.27.104.50034 > 165.227.37.88.ssh: Flags [.], ack 276, win 513, length 0
20:31:49.272884 IP 97.109.27.104.50034 > 165.227.37.88.ssh: Flags [P.], seq 89:133, ack 276, win 513, length 44
20:31:49.273094 IP 165.227.37.88.ssh > 97.109.27.104.50034: Flags [P.], seq 276:320, ack 133, win 501, length 44
20:31:49.339858 IP 97.109.27.104.50034 > 165.227.37.88.ssh: Flags [.], ack 320, win 513, length 0
20:31:49.619810 IP 97.109.27.104.50034 > 165.227.37.88.ssh: Flags [P.], seq 133:169, ack 320, win 513, length 36
20:31:49.620024 IP 165.227.37.88.ssh > 97.109.27.104.50034: Flags [P.], seq 320:364, ack 169, win 501, length 44
20:31:49.689832 IP 97.109.27.104.50034 > 165.227.37.88.ssh: Flags [.], ack 364, win 513, length 0
20:31:49.934306 IP 49.88.112.73.11372 > 165.227.37.88.ssh: Flags [P.], seq 16:872, ack 42, win 229, options [nop,nop,TS val 542615078 ecr 1952035774], length 856
20:31:50.114932 IP 97.109.27.104.50034 > 165.227.37.88.ssh: Flags [P.], seq 169:205, ack 364, win 513, length 36
20:31:50.115118 IP 165.227.37.88.ssh > 97.109.27.104.50034: Flags [P.], seq 364:408, ack 205, win 501, length 44
20:31:50.137861 IP 97.109.27.104.50034 > 165.227.37.88.ssh: Flags [P.], seq 205:241, ack 364, win 513, length 36
20:31:50.138041 IP 165.227.37.88.ssh > 97.109.27.104.50034: Flags [P.], seq 408:452, ack 241, win 501, length 44
20:31:50.164856 IP 97.109.27.104.50034 > 165.227.37.88.ssh: Flags [.], ack 452, win 512, length 0
20:31:50.170781 IP 97.109.27.104.50034 > 165.227.37.88.ssh: Flags [P.], seq 241:277, ack 452, win 512, length 36
20:31:50.170965 IP 165.227.37.88.ssh > 97.109.27.104.50034: Flags [P.], seq 452:496, ack 277, win 501, length 44
20:31:50.196863 IP 97.109.27.104.50034 > 165.227.37.88.ssh: Flags [P.], seq 277:313, ack 496, win 512, length 36
20:31:50.197064 IP 165.227.37.88.ssh > 97.109.27.104.50034: Flags [P.], seq 496:540, ack 313, win 501, length 44
20:31:50.230840 IP 97.109.27.104.50034 > 165.227.37.88.ssh: Flags [P.], seq 313:349, ack 540, win 512, length 36
20:31:50.231010 IP 165.227.37.88.ssh > 97.109.27.104.50034: Flags [P.], seq 540:584, ack 349, win 501, length 44
20:31:50.259754 IP 97.109.27.104.50034 > 165.227.37.88.ssh: Flags [P.], seq 349:385, ack 584, win 512, length 36
20:31:50.259931 IP 165.227.37.88.ssh > 97.109.27.104.50034: Flags [P.], seq 584:628, ack 385, win 501, length 44
20:31:50.289877 IP 97.109.27.104.50034 > 165.227.37.88.ssh: Flags [P.], seq 385:421, ack 628, win 512, length 36
20:31:50.290055 IP 165.227.37.88.ssh > 97.109.27.104.50034: Flags [P.], seq 628:672, ack 421, win 501, length 44
20:31:50.324807 IP 97.109.27.104.50034 > 165.227.37.88.ssh: Flags [P.], seq 421:457, ack 672, win 512, length 36
20:31:50.325006 IP 165.227.37.88.ssh > 97.109.27.104.50034: Flags [P.], seq 672:716, ack 457, win 501, length 44
20:31:50.354854 IP 97.109.27.104.50034 > 165.227.37.88.ssh: Flags [P.], seq 457:493, ack 716, win 511, length 36
20:31:50.389820 IP 97.109.27.104.50034 > 165.227.37.88.ssh: Flags [P.], seq 493:529, ack 716, win 511, length 36
20:31:50.389866 IP 165.227.37.88.ssh > 97.109.27.104.50034: Flags [.], ack 529, win 501, length 0
20:31:50.418784 IP 97.109.27.104.50034 > 165.227.37.88.ssh: Flags [P.], seq 529:565, ack 716, win 511, length 36
20:31:50.454819 IP 97.109.27.104.50034 > 165.227.37.88.ssh: Flags [P.], seq 565:601, ack 716, win 511, length 36
20:31:50.454876 IP 165.227.37.88.ssh > 97.109.27.104.50034: Flags [.], ack 601, win 501, length 0
20:31:50.458325 IP net6-ip210.linkbg.com.51020 > 165.227.37.88.submissions: Flags [S], seq 2734283473, win 29200, options [mss 1460,sackOK,TS val 4176632281 ecr 0,nop,wscale 7], length 0
20:31:50.478832 IP 97.109.27.104.50034 > 165.227.37.88.ssh: Flags [P.], seq 601:637, ack 716, win 511, length 36
20:31:50.513845 IP 97.109.27.104.50034 > 165.227.37.88.ssh: Flags [P.], seq 637:673, ack 716, win 511, length 36
20:31:50.513882 IP 165.227.37.88.ssh > 97.109.27.104.50034: Flags [.], ack 673, win 501, length 0
root@lamp-ubuntu-s-1vcpu-1gb-tor1-01:~# ^C
root@lamp-ubuntu-s-1vcpu-1gb-tor1-01:~#
