1236848:1237012, ack 649, win 501, length 164
20:33:19.091134 IP 165.227.37.88.ssh > 97.109.27.104.50034: Flags [P.], seq 1237012:1237176, ack 649, win 501, length 164
20:33:19.091194 IP 165.227.37.88.ssh > 97.109.27.104.50034: Flags [P.], seq 1237176:1237340, ack 649, win 501, length 164
20:33:19.091252 IP 165.227.37.88.ssh > 97.109.27.104.50034: Flags [P.], seq 1237340:1237504, ack 649, win 501, length 164
20:33:19.091308 IP 165.227.37.88.ssh > 97.109.27.104.50034: Flags [P.], seq 1237504:1237668, ack 649, win 501, length 164
20:33:19.091364 IP 165.227.37.88.ssh > 97.109.27.104.50034: Flags [P.], seq 1237668:1237832, ack 649, win 501, length 164
20:33:19.091418 IP 165.227.37.88.ssh > 97.109.27.104.50034: Flags [P.], seq 1237832:1237996, ack 649, win 501, length 164
20:33:19.091471 IP 165.227.37.88.ssh > 97.109.27.104.50034: Flags [P.], seq 1237996:1238160, ack 649, win 501, length 164
20:33:19.091535 IP 165.227.37.88.ssh > 97.109.27.104.50034: Flags [P.], seq 1238160:1238324, ack 649, win 501, length 164
20:33:19.091592 IP 165.227.37.88.ssh > 97.109.27.104.50034: Flags [P.], seq 1238324:1238488, ack 649, win 501, length 164
20:33:19.091694 IP 165.227.37.88.ssh > 97.109.27.104.50034: Flags [P.], seq 1238488:1238652, ack 649, win 501, length 164
20:33:19.091774 IP 165.227.37.88.ssh > 97.109.27.104.50034: Flags [P.], seq 1238652:1238816, ack 649, win 501, length 164
20:33:19.091835 IP 165.227.37.88.ssh > 97.109.27.104.50034: Flags [P.], seq 1238816:1238980, ack 649, win 501, length 164
20:33:19.091920 IP 165.227.37.88.ssh > 97.109.27.104.50034: Flags [P.], seq 1238980:1239144, ack 649, win 501, length 164
20:33:19.092000 IP 165.227.37.88.ssh > 97.109.27.104.50034: Flags [P.], seq 1239144:1239308, ack 649, win 501, length 164
20:33:19.092087 IP 165.227.37.88.ssh > 97.109.27.104.50034: Flags [P.], seq 1239308:1239472, ack 649, win 501, length 164
20:33:19.092828 IP 97.109.27.104.50034 > 165.227.37.88.ssh: Flags [P.], seq 649:685, ack 1162928, win 509, length 36
20:33:19.092854 IP 97.109.27.104.50034 > 165.227.37.88.ssh: Flags [P.], seq 685:721, ack 1177488, win 514, length 36
^C
8133 packets captured
8135 packets received by filter
