 492972:493128, ack 253, win 501, length 156
20:32:36.579992 IP 165.227.37.88.22 > 97.109.27.104.50034: Flags [P.], seq 493128:493284, ack 253, win 501, length 156
20:32:36.580045 IP 165.227.37.88.22 > 97.109.27.104.50034: Flags [P.], seq 493284:493440, ack 253, win 501, length 156
20:32:36.580125 IP 165.227.37.88.22 > 97.109.27.104.50034: Flags [P.], seq 493440:493596, ack 253, win 501, length 156
20:32:36.580221 IP 165.227.37.88.22 > 97.109.27.104.50034: Flags [P.], seq 493596:493752, ack 253, win 501, length 156
20:32:36.580311 IP 165.227.37.88.22 > 97.109.27.104.50034: Flags [P.], seq 493752:493908, ack 253, win 501, length 156
20:32:36.580370 IP 165.227.37.88.22 > 97.109.27.104.50034: Flags [P.], seq 493908:494064, ack 253, win 501, length 156
20:32:36.580424 IP 165.227.37.88.22 > 97.109.27.104.50034: Flags [P.], seq 494064:494220, ack 253, win 501, length 156
20:32:36.580525 IP 165.227.37.88.22 > 97.109.27.104.50034: Flags [P.], seq 494220:494376, ack 253, win 501, length 156
20:32:36.580607 IP 165.227.37.88.22 > 97.109.27.104.50034: Flags [P.], seq 494376:494532, ack 253, win 501, length 156
20:32:36.580665 IP 165.227.37.88.22 > 97.109.27.104.50034: Flags [P.], seq 494532:494688, ack 253, win 501, length 156
20:32:36.580720 IP 165.227.37.88.22 > 97.109.27.104.50034: Flags [P.], seq 494688:494844, ack 253, win 501, length 156
20:32:36.580736 IP 97.109.27.104.50034 > 165.227.37.88.22: Flags [P.], seq 253:289, ack 466524, win 515, length 36
^C
3256 packets captured
3257 packets received by filter
0 packets dropped by kernel
root@lamp-ubuntu-s-1vcpu-1gb-tor1-01:~#
