20:28:13.085838 IP 97.109.27.104.50034 > 165.227.37.88.ssh: Flags [.], ack 3041856, win 292, length 0
EX.(.*@.y..=am.h..%X.r..# ....Z.P..$D.........
20:28:13.091001 IP 97.109.27.104.50034 > 165.227.37.88.ssh: Flags [.], ack 3046020, win 276, length 0
EX.(.+@.y..<am.h..%X.r..# ....k=P...3.........
20:28:13.091031 IP 97.109.27.104.50034 > 165.227.37.88.ssh: Flags [.], ack 3069616, win 184, length 0
EX.(.,@.y..;am.h..%X.r..# .....iP.............
20:28:13.095936 IP 97.109.27.104.50034 > 165.227.37.88.ssh: Flags [.], ack 3079332, win 146, length 0
EX.(.-@.y..:am.h..%X.r..# .....]P....>........
20:28:13.095973 IP 97.109.27.104.50034 > 165.227.37.88.ssh: Flags [.], ack 3080720, win 140, length 0
EX.(..@.y..9am.h..%X.r..# ......P.............
20:28:13.095978 IP 97.109.27.104.50034 > 165.227.37.88.ssh: Flags [.], ack 3107092, win 37, length 0
EX.(./@.y..8am.h..%X.r..# ....Y.P..%F;........
20:28:13.100887 IP 97.109.27.104.50034 > 165.227.37.88.ssh: Flags [.], ack 3108480, win 32, length 0
EX.(.0@.y..7am.h..%X.r..# ...._9P.. @.........
20:28:13.100913 IP 97.109.27.104.50034 > 165.227.37.88.ssh: Flags [.], ack 3116768, win 0, length 0
EX.(.1@.y..6am.h..%X.r..# ......P... .........
20:28:13.153882 IP 97.109.27.104.50034 > 165.227.37.88.ssh: Flags [P.], seq 1477:1585, ack 3116768, win 0, length 108
^CEX...2@.y...am.h..%X.r..# ......P...t....|.R..j...(g.S....%..7...n.?..UI<...s.!.eN.....;%.=..>.Q?<.M...JN.......T7P.......|7a(r.]..XK>....6;.o.G7.}W

1153 packets captured
1202 packets received by filter
47 packets dropped by kernel
