9680:13209844, ack 6913, win 501, length 164
20:23:07.425780 IP 165.227.37.88.ssh > 97.109.27.104.50034: Flags [P.], seq 13209844:13210008, ack 6913, win 501, length 164
20:23:07.425873 IP 165.227.37.88.ssh > 97.109.27.104.50034: Flags [P.], seq 13210008:13210172, ack 6913, win 501, length 164
20:23:07.425966 IP 165.227.37.88.ssh > 97.109.27.104.50034: Flags [P.], seq 13210172:13210336, ack 6913, win 501, length 164
20:23:07.426059 IP 165.227.37.88.ssh > 97.109.27.104.50034: Flags [P.], seq 13210336:13210500, ack 6913, win 501, length 164
20:23:07.426152 IP 165.227.37.88.ssh > 97.109.27.104.50034: Flags [P.], seq 13210500:13210664, ack 6913, win 501, length 164
20:23:07.426245 IP 165.227.37.88.ssh > 97.109.27.104.50034: Flags [P.], seq 13210664:13210828, ack 6913, win 501, length 164
20:23:07.426338 IP 165.227.37.88.ssh > 97.109.27.104.50034: Flags [P.], seq 13210828:13210992, ack 6913, win 501, length 164
20:23:07.426423 IP 165.227.37.88.ssh > 97.109.27.104.50034: Flags [P.], seq 13210992:13211156, ack 6913, win 501, length 164
20:23:07.426528 IP 165.227.37.88.ssh > 97.109.27.104.50034: Flags [P.], seq 13211156:13211320, ack 6913, win 501, length 164
20:23:07.426627 IP 165.227.37.88.ssh > 97.109.27.104.50034: Flags [P.], seq 13211320:13211484, ack 6913, win 501, length 164
20:23:07.426716 IP 165.227.37.88.ssh > 97.109.27.104.50034: Flags [P.], seq 13211484:13211648, ack 6913, win 501, length 164
20:23:07.426974 IP 165.227.37.88.ssh > 97.109.27.104.50034: Flags [P.], seq 13211648:13211812, ack 6913, win 501, length 164
20:23:07.427069 IP 165.227.37.88.ssh > 97.109.27.104.50034: Flags [P.], seq 13211812:13211976, ack 6913, win 501, length 164
20:23:07.427155 IP 165.227.37.88.ssh > 97.109.27.104.50034: Flags [P.], seq 13211976:13212140, ack 6913, win 501, length 164
20:23:07.427245 IP 165.227.37.88.ssh > 97.109.27.104.50034: Flags [P.], seq 13212140:13212304, ack 6913, win 501, length 164
20:23:07.427325 IP 165.227.37.88.ssh > 97.109.27.104.50034: Flags [P.], seq 13212304:13212468, ack 6913, win 501, length 164
20:23:07.427412 IP 165.227.37.88.ssh > 97.109.27.104.50034: Flags [P.], seq 13212468:13212632, ack 6913, win 501, length 164
20:23:07.427504 IP 165.227.37.88.ssh > 97.109.27.104.50034: Flags [P.], seq 13212632:13212796, ack 6913, win 501, length 164
20:23:07.427585 IP 165.227.37.88.ssh > 97.109.27.104.50034: Flags [P.], seq 13212796:13212960, ack 6913, win 501, length 164
20:23:07.427669 IP 165.227.37.88.ssh > 97.109.27.104.50034: Flags [P.], seq 13212960:13213124, ack 6913, win 501, length 164
20:23:07.427762 IP 165.227.37.88.ssh > 97.109.27.104.50034: Flags [P.], seq 13213124:13213288, ack 6913, win 501, length 164
20:23:07.427846 IP 165.227.37.88.ssh > 97.109.27.104.50034: Flags [P.], seq 13213288:13213452, ack 6913, win 501, length 164
20:23:07.427931 IP 165.227.37.88.ssh > 97.109.27.104.50034: Flags [P.], seq 13213452:13213616, ack 6913, win 501, length 164
20:23:07.428013 IP 165.227.37.88.ssh > 97.109.27.104.50034: Flags [P.], seq 13213616:13213780, ack 6913, win 501, length 164
20:23:07.428093 IP 165.227.37.88.ssh > 97.109.27.104.50034: Flags [P.], seq 13213780:13213944, ack 6913, win 501, length 164
20:23:07.428175 IP 165.227.37.88.ssh > 97.109.27.104.50034: Flags [P.], seq 13213944:13214108, ack 6913, win 501, length 164
20:23:07.428326 IP 165.227.37.88.ssh > 97.109.27.104.50034: Flags [P.], seq 13214108:13214272, ack 6913, win 501, length 164
20:23:07.428428 IP 165.227.37.88.ssh > 97.109.27.104.50034: Flags [P.], seq 13214272:13214436, ack 6913, win 501, length 164
20:23:07.428508 IP 165.227.37.88.ssh > 97.109.27.104.50034: Flags [P.], seq 13214436:13214600, ack 6913, win 501, length 164
20:23:07.428591 IP 165.227.37.88.ssh > 97.109.27.104.50034: Flags [P.], seq 13214600:13214764, ack 6913, win 501, length 164
20:23:07.428675 IP 165.227.37.88.ssh > 97.109.27.104.50034: Flags [P.], seq 13214764:13214928, ack 6913, win 501, length 164
20:23:07.428757 IP 165.227.37.88.ssh > 97.109.27.104.50034: Flags [P.], seq 13214928:13215092, ack 6913, win 501, length 164
20:23:07.428844 IP 165.227.37.88.ssh > 97.109.27.104.50034: Flags [P.], seq 13215092:13215256, ack 6913, win 501, length 164
20:23:07.428925 IP 165.227.37.88.ssh > 97.109.27.104.50034: Flags [P.], seq 13215256:13215420, ack 6913, win 501, length 164
20:23:07.429009 IP 165.227.37.88.ssh > 97.109.27.104.50034: Flags [P.], seq 13215420:13215584, ack 6913, win 501, length 164
20:23:07.429099 IP 165.227.37.88.ssh > 97.109.27.104.50034: Flags [P.], seq 13215584:13215748, ack 6913, win 501, length 164
20:23:07.429189 IP 165.227.37.88.ssh > 97.109.27.104.50034: Flags [P.], seq 13215748:13215912, ack 6913, win 501, length 164
20:23:07.429300 IP 165.227.37.88.ssh > 97.109.27.104.50034: Flags [P.], seq 13215912:13216076, ack 6913, win 501, length 164
20:23:07.429409 IP 165.227.37.88.ssh > 97.109.27.104.50034: Flags [P.], seq 13216076:13216240, ack 6913, win 501, length 164
20:23:07.429499 IP 165.227.37.88.ssh > 97.109.27.104.50034: Flags [P.], seq 13216240:13216404, ack 6913, win 501, length 164
20:23:07.429582 IP 165.227.37.88.ssh > 97.109.27.104.50034: Flags [P.], seq 13216404:13216568, ack 6913, win 501, length 164
20:23:07.429664 IP 165.227.37.88.ssh > 97.109.27.104.50034: Flags [P.], seq 13216568:13216732, ack 6913, win 501, length 164
20:23:07.429748 IP 165.227.37.88.ssh > 97.109.27.104.50034: Flags [P.], seq 13216732:13216896, ack 6913, win 501, length 164
20:23:07.429836 IP 165.227.37.88.ssh > 97.109.27.104.50034: Flags [P.], seq 13216896:13217060, ack 6913, win 501, length 164
20:23:07.429919 IP 165.227.37.88.ssh > 97.109.27.104.50034: Flags [P.], seq 13217060:13217224, ack 6913, win 501, length 164
20:23:07.430020 IP 165.227.37.88.ssh > 97.109.27.104.50034: Flags [P.], seq 13217224:13217388, ack 6913, win 501, length 164
20:23:07.430109 IP 165.227.37.88.ssh > 97.109.27.104.50034: Flags [P.], seq 13217388:13217552, ack 6913, win 501, length 164
20:23:07.430200 IP 165.227.37.88.ssh > 97.109.27.104.50034: Flags [P.], seq 13217552:13217716, ack 6913, win 501, length 164
20:23:07.430288 IP 165.227.37.88.ssh > 97.109.27.104.50034: Flags [P.], seq 13217716:13217880, ack 6913, win 501, length 164
20:23:07.430381 IP 165.227.37.88.ssh > 97.109.27.104.50034: Flags [P.], seq 13217880:13218044, ack 6913, win 501, length 164
20:23:07.430475 IP 165.227.37.88.ssh > 97.109.27.104.50034: Flags [P.], seq 13218044:13218208, ack 6913, win 501, length 164
20:23:07.430567 IP 165.227.37.88.ssh > 97.109.27.104.50034: Flags [P.], seq 13218208:13218372, ack 6913, win 501, length 164
20:23:07.430663 IP 165.227.37.88.ssh > 97.109.27.104.50034: Flags [P.], seq 13218372:13218536, ack 6913, win 501, length 164
20:23:07.430751 IP 165.227.37.88.ssh > 97.109.27.104.50034: Flags [P.], seq 13218536:13218700, ack 6913, win 501, length 164
20:23:07.430841 IP 165.227.37.88.ssh > 97.109.27.104.50034: Flags [P.], seq 13218700:13218864, ack 6913, win 501, length 164
20:23:07.430928 IP 165.227.37.88.ssh > 97.109.27.104.50034: Flags [P.], seq 13218864:13219028, ack 6913, win 501, length 164
20:23:07.431015 IP 165.227.37.88.ssh > 97.109.27.104.50034: Flags [P.], seq 13219028:13219192, ack 6913, win 501, length 164
20:23:07.431104 IP 165.227.37.88.ssh > 97.109.27.104.50034: Flags [P.], seq 13219192:13219356, ack 6913, win 501, length 164
20:23:07.431196 IP 165.227.37.88.ssh > 97.109.27.104.50034: Flags [P.], seq 13219356:13219520, ack 6913, win 501, length 164
20:23:07.431293 IP 165.227.37.88.ssh > 97.109.27.104.50034: Flags [P.], seq 13219520:13219684, ack 6913, win 501, length 164
20:23:07.431388 IP 165.227.37.88.ssh > 97.109.27.104.50034: Flags [P.], seq 13219684:13219848, ack 6913, win 501, length 164
20:23:07.431479 IP 165.227.37.88.ssh > 97.109.27.104.50034: Flags [P.], seq 13219848:13220012, ack 6913, win 501, length 164
20:23:07.431570 IP 165.227.37.88.ssh > 97.109.27.104.50034: Flags [P.], seq 13220012:13220176, ack 6913, win 501, length 164
20:23:07.431656 IP 165.227.37.88.ssh > 97.109.27.104.50034: Flags [P.], seq 13220176:13220340, ack 6913, win 501, length 164
20:23:07.431752 IP 165.227.37.88.ssh > 97.109.27.104.50034: Flags [P.], seq 13220340:13220504, ack 6913, win 501, length 164
20:23:07.431836 IP 165.227.37.88.ssh > 97.109.27.104.50034: Flags [P.], seq 13220504:13220668, ack 6913, win 501, length 164
20:23:07.431916 IP 165.227.37.88.ssh > 97.109.27.104.50034: Flags [P.], seq 13220668:13220832, ack 6913, win 501, length 164
20:23:07.431999 IP 165.227.37.88.ssh > 97.109.27.104.50034: Flags [P.], seq 13220832:13220996, ack 6913, win 501, length 164
20:23:07.432095 IP 165.227.37.88.ssh > 97.109.27.104.50034: Flags [P.], seq 13220996:13221160, ack 6913, win 501, length 164
20:23:07.432191 IP 165.227.37.88.ssh > 97.109.27.104.50034: Flags [P.], seq 13221160:13221324, ack 6913, win 501, length 164
20:23:07.432283 IP 165.227.37.88.ssh > 97.109.27.104.50034: Flags [P.], seq 13221324:13221488, ack 6913, win 501, length 164
20:23:07.432372 IP 165.227.37.88.ssh > 97.109.27.104.50034: Flags [P.], seq 13221488:13221652, ack 6913, win 501, length 164
20:23:07.432465 IP 165.227.37.88.ssh > 97.109.27.104.50034: Flags [P.], seq 13221652:13221816, ack 6913, win 501, length 164
20:23:07.432562 IP 165.227.37.88.ssh > 97.109.27.104.50034: Flags [P.], seq 13221816:13221980, ack 6913, win 501, length 164
20:23:07.432651 IP 165.227.37.88.ssh > 97.109.27.104.50034: Flags [P.], seq 13221980:13222144, ack 6913, win 501, length 164
20:23:07.432744 IP 165.227.37.88.ssh > 97.109.27.104.50034: Flags [P.], seq 13222144:13222308, ack 6913, win 501, length 164
20:23:07.432838 IP 165.227.37.88.ssh > 97.109.27.104.50034: Flags [P.], seq 13222308:13222472, ack 6913, win 501, length 164
20:23:07.432926 IP 165.227.37.88.ssh > 97.109.27.104.50034: Flags [P.], seq 13222472:13222636, ack 6913, win 501, length 164
20:23:07.433020 IP 165.227.37.88.ssh > 97.109.27.104.50034: Flags [P.], seq 13222636:13222800, ack 6913, win 501, length 164
20:23:07.433106 IP 165.227.37.88.ssh > 97.109.27.104.50034: Flags [P.], seq 13222800:13222964, ack 6913, win 501, length 164
20:23:07.433192 IP 165.227.37.88.ssh > 97.109.27.104.50034: Flags [P.], seq 13222964:13223128, ack 6913, win 501, length 164
20:23:07.433296 IP 165.227.37.88.ssh > 97.109.27.104.50034: Flags [P.], seq 13223128:13223292, ack 6913, win 501, length 164
20:23:07.433395 IP 165.227.37.88.ssh > 97.109.27.104.50034: Flags [P.], seq 13223292:13223456, ack 6913, win 501, length 164
20:23:07.433522 IP 165.227.37.88.ssh > 97.109.27.104.50034: Flags [P.], seq 13223456:13223620, ack 6913, win 501, length 164
20:23:07.433610 IP 165.227.37.88.ssh > 97.109.27.104.50034: Flags [P.], seq 13223620:13223784, ack 6913, win 501, length 164
20:23:07.433693 IP 165.227.37.88.ssh > 97.109.27.104.50034: Flags [P.], seq 13223784:13223948, ack 6913, win 501, length 164
20:23:07.433775 IP 165.227.37.88.ssh > 97.109.27.104.50034: Flags [P.], seq 13223948:13224112, ack 6913, win 501, length 164
20:23:07.433858 IP 165.227.37.88.ssh > 97.109.27.104.50034: Flags [P.], seq 13224112:13224276, ack 6913, win 501, length 164
20:23:07.433941 IP 165.227.37.88.ssh > 97.109.27.104.50034: Flags [P.], seq 13224276:13224440, ack 6913, win 501, length 164
20:23:07.434025 IP 165.227.37.88.ssh > 97.109.27.104.50034: Flags [P.], seq 13224440:13224604, ack 6913, win 501, length 164
20:23:07.434106 IP 165.227.37.88.ssh > 97.109.27.104.50034: Flags [P.], seq 13224604:13224768, ack 6913, win 501, length 164
20:23:07.434194 IP 165.227.37.88.ssh > 97.109.27.104.50034: Flags [P.], seq 13224768:13224932, ack 6913, win 501, length 164
20:23:07.434277 IP 165.227.37.88.ssh > 97.109.27.104.50034: Flags [P.], seq 13224932:13225096, ack 6913, win 501, length 164
20:23:07.434355 IP 165.227.37.88.ssh > 97.109.27.104.50034: Flags [P.], seq 13225096:13225260, ack 6913, win 501, length 164
20:23:07.434440 IP 165.227.37.88.ssh > 97.109.27.104.50034: Flags [P.], seq 13225260:13225424, ack 6913, win 501, length 164
20:23:07.434517 IP 165.227.37.88.ssh > 97.109.27.104.50034: Flags [P.], seq 13225424:13225588, ack 6913, win 501, length 164
20:23:07.434602 IP 165.227.37.88.ssh > 97.109.27.104.50034: Flags [P.], seq 13225588:13225752, ack 6913, win 501, length 164
20:23:07.434683 IP 165.227.37.88.ssh > 97.109.27.104.50034: Flags [P.], seq 13225752:13225916, ack 6913, win 501, length 164
20:23:07.434762 IP 165.227.37.88.ssh > 97.109.27.104.50034: Flags [P.], seq 13225916:13226080, ack 6913, win 501, length 164
20:23:07.434850 IP 165.227.37.88.ssh > 97.109.27.104.50034: Flags [P.], seq 13226080:13226244, ack 6913, win 501, length 164
20:23:07.434928 IP 165.227.37.88.ssh > 97.109.27.104.50034: Flags [P.], seq 13226244:13226408, ack 6913, win 501, length 164
20:23:07.435010 IP 165.227.37.88.ssh > 97.109.27.104.50034: Flags [P.], seq 13226408:13226572, ack 6913, win 501, length 164
20:23:07.435097 IP 165.227.37.88.ssh > 97.109.27.104.50034: Flags [P.], seq 13226572:13226736, ack 6913, win 501, length 164
20:23:07.435183 IP 165.227.37.88.ssh > 97.109.27.104.50034: Flags [P.], seq 13226736:13226900, ack 6913, win 501, length 164
20:23:07.435263 IP 165.227.37.88.ssh > 97.109.27.104.50034: Flags [P.], seq 13226900:13227064, ack 6913, win 501, length 164
20:23:07.435346 IP 165.227.37.88.ssh > 97.109.27.104.50034: Flags [P.], seq 13227064:13227228, ack 6913, win 501, length 164
20:23:07.435427 IP 165.227.37.88.ssh > 97.109.27.104.50034: Flags [P.], seq 13227228:13227392, ack 6913, win 501, length 164
20:23:07.435510 IP 165.227.37.88.ssh > 97.109.27.104.50034: Flags [P.], seq 13227392:13227556, ack 6913, win 501, length 164
20:23:07.435599 IP 165.227.37.88.ssh > 97.109.27.104.50034: Flags [P.], seq 13227556:13227720, ack 6913, win 501, length 164
20:23:07.435702 IP 165.227.37.88.ssh > 97.109.27.104.50034: Flags [P.], seq 13227720:13227884, ack 6913, win 501, length 164
20:23:07.435788 IP 165.227.37.88.ssh > 97.109.27.104.50034: Flags [P.], seq 13227884:13228048, ack 6913, win 501, length 164
20:23:07.435871 IP 165.227.37.88.ssh > 97.109.27.104.50034: Flags [P.], seq 13228048:13228212, ack 6913, win 501, length 164
20:23:07.435954 IP 165.227.37.88.ssh > 97.109.27.104.50034: Flags [P.], seq 13228212:13228376, ack 6913, win 501, length 164
20:23:07.436044 IP 165.227.37.88.ssh > 97.109.27.104.50034: Flags [P.], seq 13228376:13228540, ack 6913, win 501, length 164
20:23:07.436123 IP 165.227.37.88.ssh > 97.109.27.104.50034: Flags [P.], seq 13228540:13228704, ack 6913, win 501, length 164
20:23:07.436212 IP 165.227.37.88.ssh > 97.109.27.104.50034: Flags [P.], seq 13228704:13228868, ack 6913, win 501, length 164
20:23:07.436293 IP 165.227.37.88.ssh > 97.109.27.104.50034: Flags [P.], seq 13228868:13229032, ack 6913, win 501, length 164
20:23:07.436370 IP 165.227.37.88.ssh > 97.109.27.104.50034: Flags [P.], seq 13229032:13229196, ack 6913, win 501, length 164
20:23:07.436454 IP 165.227.37.88.ssh > 97.109.27.104.50034: Flags [P.], seq 13229196:13229360, ack 6913, win 501, length 164
20:23:07.436538 IP 165.227.37.88.ssh > 97.109.27.104.50034: Flags [P.], seq 13229360:13229524, ack 6913, win 501, length 164
20:23:07.436618 IP 165.227.37.88.ssh > 97.109.27.104.50034: Flags [P.], seq 13229524:13229688, ack 6913, win 501, length 164
20:23:07.436709 IP 165.227.37.88.ssh > 97.109.27.104.50034: Flags [P.], seq 13229688:13229852, ack 6913, win 501, length 164
20:23:07.436794 IP 165.227.37.88.ssh > 97.109.27.104.50034: Flags [P.], seq 13229852:13230016, ack 6913, win 501, length 164
20:23:07.436877 IP 165.227.37.88.ssh > 97.109.27.104.50034: Flags [P.], seq 13230016:13230180, ack 6913, win 501, length 164
20:23:07.436961 IP 165.227.37.88.ssh > 97.109.27.104.50034: Flags [P.], seq 13230180:13230344, ack 6913, win 501, length 164
20:23:07.437039 IP 165.227.37.88.ssh > 97.109.27.104.50034: Flags [P.], seq 13230344:13230508, ack 6913, win 501, length 164
20:23:07.437126 IP 165.227.37.88.ssh > 97.109.27.104.50034: Flags [P.], seq 13230508:13230672, ack 6913, win 501, length 164
20:23:07.437214 IP 165.227.37.88.ssh > 97.109.27.104.50034: Flags [P.], seq 13230672:13230836, ack 6913, win 501, length 164
20:23:07.437318 IP 165.227.37.88.ssh > 97.109.27.104.50034: Flags [P.], seq 13230836:13231000, ack 6913, win 501, length 164
20:23:07.437424 IP 165.227.37.88.ssh > 97.109.27.104.50034: Flags [P.], seq 13231000:13231164, ack 6913, win 501, length 164
20:23:07.437512 IP 165.227.37.88.ssh > 97.109.27.104.50034: Flags [P.], seq 13231164:13231328, ack 6913, win 501, length 164
20:23:07.437603 IP 165.227.37.88.ssh > 97.109.27.104.50034: Flags [P.], seq 13231328:13231492, ack 6913, win 501, length 164
20:23:07.437687 IP 165.227.37.88.ssh > 97.109.27.104.50034: Flags [P.], seq 13231492:13231656, ack 6913, win 501, length 164
20:23:07.437781 IP 165.227.37.88.ssh > 97.109.27.104.50034: Flags [P.], seq 13231656:13231820, ack 6913, win 501, length 164
20:23:07.437866 IP 165.227.37.88.ssh > 97.109.27.104.50034: Flags [P.], seq 13231820:13231984, ack 6913, win 501, length 164
20:23:07.437950 IP 165.227.37.88.ssh > 97.109.27.104.50034: Flags [P.], seq 13231984:13232148, ack 6913, win 501, length 164
20:23:07.438033 IP 165.227.37.88.ssh > 97.109.27.104.50034: Flags [P.], seq 13232148:13232312, ack 6913, win 501, length 164
20:23:07.438118 IP 165.227.37.88.ssh > 97.109.27.104.50034: Flags [P.], seq 13232312:13232476, ack 6913, win 501, length 164
20:23:07.438207 IP 165.227.37.88.ssh > 97.109.27.104.50034: Flags [P.], seq 13232476:13232640, ack 6913, win 501, length 164
20:23:07.438305 IP 165.227.37.88.ssh > 97.109.27.104.50034: Flags [P.], seq 13232640:13232804, ack 6913, win 501, length 164
20:23:07.438399 IP 165.227.37.88.ssh > 97.109.27.104.50034: Flags [P.], seq 13232804:13232968, ack 6913, win 501, length 164
20:23:07.438486 IP 165.227.37.88.ssh > 97.109.27.104.50034: Flags [P.], seq 13232968:13233132, ack 6913, win 501, length 164
20:23:07.438580 IP 165.227.37.88.ssh > 97.109.27.104.50034: Flags [P.], seq 13233132:13233296, ack 6913, win 501, length 164
20:23:07.438669 IP 165.227.37.88.ssh > 97.109.27.104.50034: Flags [P.], seq 13233296:13233460, ack 6913, win 501, length 164
20:23:07.438756 IP 165.227.37.88.ssh > 97.109.27.104.50034: Flags [P.], seq 13233460:13233624, ack 6913, win 501, length 164
20:23:07.438844 IP 165.227.37.88.ssh > 97.109.27.104.50034: Flags [P.], seq 13233624:13233788, ack 6913, win 501, length 164
20:23:07.438948 IP 165.227.37.88.ssh > 97.109.27.104.50034: Flags [P.], seq 13233788:13233952, ack 6913, win 501, length 164
20:23:07.439034 IP 165.227.37.88.ssh > 97.109.27.104.50034: Flags [P.], seq 13233952:13234116, ack 6913, win 501, length 164
20:23:07.439089 IP 97.109.27.104.50034 > 165.227.37.88.ssh: Flags [.], ack 13163248, win 295, length 0
20:23:07.439122 IP 97.109.27.104.50034 > 165.227.37.88.ssh: Flags [.], ack 13163452, win 295, length 0
20:23:07.439128 IP 97.109.27.104.50034 > 165.227.37.88.ssh: Flags [.], ack 13165492, win 287, length 0
20:23:07.439234 IP 165.227.37.88.ssh > 97.109.27.104.50034: Flags [P.], seq 13234116:13234592, ack 6913, win 501, length 476
20:23:07.439324 IP 165.227.37.88.ssh > 97.109.27.104.50034: Flags [P.], seq 13234592:13234756, ack 6913, win 501, length 164
20:23:07.439423 IP 165.227.37.88.ssh > 97.109.27.104.50034: Flags [P.], seq 13234756:13234920, ack 6913, win 501, length 164
20:23:07.439509 IP 165.227.37.88.ssh > 97.109.27.104.50034: Flags [P.], seq 13234920:13235084, ack 6913, win 501, length 164
20:23:07.439589 IP 165.227.37.88.ssh > 97.109.27.104.50034: Flags [P.], seq 13235084:13235248, ack 6913, win 501, length 164
20:23:07.439665 IP 165.227.37.88.ssh > 97.109.27.104.50034: Flags [P.], seq 13235248:13235412, ack 6913, win 501, length 164
20:23:07.439743 IP 165.227.37.88.ssh > 97.109.27.104.50034: Flags [P.], seq 13235412:13235576, ack 6913, win 501, length 164
20:23:07.439822 IP 165.227.37.88.ssh > 97.109.27.104.50034: Flags [P.], seq 13235576:13235740, ack 6913, win 501, length 164
20:23:07.439906 IP 165.227.37.88.ssh > 97.109.27.104.50034: Flags [P.], seq 13235740:13235904, ack 6913, win 501, length 164
20:23:07.439984 IP 165.227.37.88.ssh > 97.109.27.104.50034: Flags [P.], seq 13235904:13236068, ack 6913, win 501, length 164
20:23:07.440035 IP 97.109.27.104.50034 > 165.227.37.88.ssh: Flags [.], ack 13168552, win 275, length 0
20:23:07.440057 IP 97.109.27.104.50034 > 165.227.37.88.ssh: Flags [.], ack 13169164, win 272, length 0
20:23:07.440067 IP 97.109.27.104.50034 > 165.227.37.88.ssh: Flags [.], ack 13170796, win 266, length 0
20:23:07.440180 IP 165.227.37.88.ssh > 97.109.27.104.50034: Flags [P.], seq 13236068:13236544, ack 6913, win 501, length 476
20:23:07.440275 IP 165.227.37.88.ssh > 97.109.27.104.50034: Flags [P.], seq 13236544:13236708, ack 6913, win 501, length 164
20:23:07.440359 IP 165.227.37.88.ssh > 97.109.27.104.50034: Flags [P.], seq 13236708:13236872, ack 6913, win 501, length 164
20:23:07.440445 IP 165.227.37.88.ssh > 97.109.27.104.50034: Flags [P.], seq 13236872:13237036, ack 6913, win 501, length 164
20:23:07.440525 IP 165.227.37.88.ssh > 97.109.27.104.50034: Flags [P.], seq 13237036:13237200, ack 6913, win 501, length 164
20:23:07.440611 IP 165.227.37.88.ssh > 97.109.27.104.50034: Flags [P.], seq 13237200:13237364, ack 6913, win 501, length 164
20:23:07.440696 IP 165.227.37.88.ssh > 97.109.27.104.50034: Flags [P.], seq 13237364:13237528, ack 6913, win 501, length 164
20:23:07.440778 IP 165.227.37.88.ssh > 97.109.27.104.50034: Flags [P.], seq 13237528:13237692, ack 6913, win 501, length 164
20:23:07.440861 IP 165.227.37.88.ssh > 97.109.27.104.50034: Flags [P.], seq 13237692:13237856, ack 6913, win 501, length 164
20:23:07.440938 IP 165.227.37.88.ssh > 97.109.27.104.50034: Flags [P.], seq 13237856:13238020, ack 6913, win 501, length 164
20:23:07.441022 IP 165.227.37.88.ssh > 97.109.27.104.50034: Flags [P.], seq 13238020:13238184, ack 6913, win 501, length 164
20:23:07.441097 IP 165.227.37.88.ssh > 97.109.27.104.50034: Flags [P.], seq 13238184:13238348, ack 6913, win 501, length 164
20:23:07.441172 IP 165.227.37.88.ssh > 97.109.27.104.50034: Flags [P.], seq 13238348:13238512, ack 6913, win 501, length 164
20:23:07.441279 IP 165.227.37.88.ssh > 97.109.27.104.50034: Flags [P.], seq 13238512:13238676, ack 6913, win 501, length 164
20:23:07.441362 IP 165.227.37.88.ssh > 97.109.27.104.50034: Flags [P.], seq 13238676:13238840, ack 6913, win 501, length 164
20:23:07.445033 IP 97.109.27.104.50034 > 165.227.37.88.ssh: Flags [.], ack 13171408, win 264, length 0
20:23:07.445069 IP 97.109.27.104.50034 > 165.227.37.88.ssh: Flags [.], ack 13172224, win 260, length 0
20:23:07.447070 IP 97.109.27.104.50034 > 165.227.37.88.ssh: Flags [.], ack 13172428, win 260, length 0
20:23:07.447093 IP 97.109.27.104.50034 > 165.227.37.88.ssh: Flags [.], ack 13178940, win 234, length 0
20:23:07.447121 IP 97.109.27.104.50034 > 165.227.37.88.ssh: Flags [.], ack 13178940, win 515, length 0
20:23:07.447133 IP 165.227.37.88.ssh > 97.109.27.104.50034: Flags [P.], seq 13238840:13239248, ack 6913, win 501, length 408
20:23:07.447451 IP 165.227.37.88.ssh > 97.109.27.104.50034: Flags [P.], seq 13239248:13239724, ack 6913, win 501, length 476
20:23:07.447568 IP 165.227.37.88.ssh > 97.109.27.104.50034: Flags [P.], seq 13239724:13239888, ack 6913, win 501, length 164
20:23:07.447679 IP 165.227.37.88.ssh > 97.109.27.104.50034: Flags [P.], seq 13239888:13240052, ack 6913, win 501, length 164
20:23:07.447784 IP 165.227.37.88.ssh > 97.109.27.104.50034: Flags [P.], seq 13240052:13240216, ack 6913, win 501, length 164
20:23:07.447880 IP 165.227.37.88.ssh > 97.109.27.104.50034: Flags [P.], seq 13240216:13240380, ack 6913, win 501, length 164
20:23:07.447973 IP 165.227.37.88.ssh > 97.109.27.104.50034: Flags [P.], seq 13240380:13240544, ack 6913, win 501, length 164
20:23:07.448065 IP 165.227.37.88.ssh > 97.109.27.104.50034: Flags [P.], seq 13240544:13240708, ack 6913, win 501, length 164
20:23:07.448157 IP 165.227.37.88.ssh > 97.109.27.104.50034: Flags [P.], seq 13240708:13240872, ack 6913, win 501, length 164
20:23:07.448248 IP 165.227.37.88.ssh > 97.109.27.104.50034: Flags [P.], seq 13240872:13241036, ack 6913, win 501, length 164
20:23:07.448337 IP 165.227.37.88.ssh > 97.109.27.104.50034: Flags [P.], seq 13241036:13241200, ack 6913, win 501, length 164
20:23:07.448434 IP 165.227.37.88.ssh > 97.109.27.104.50034: Flags [P.], seq 13241200:13241364, ack 6913, win 501, length 164
20:23:07.448535 IP 165.227.37.88.ssh > 97.109.27.104.50034: Flags [P.], seq 13241364:13241528, ack 6913, win 501, length 164
20:23:07.448630 IP 165.227.37.88.ssh > 97.109.27.104.50034: Flags [P.], seq 13241528:13241692, ack 6913, win 501, length 164
20:23:07.448717 IP 165.227.37.88.ssh > 97.109.27.104.50034: Flags [P.], seq 13241692:13241856, ack 6913, win 501, length 164
20:23:07.448808 IP 165.227.37.88.ssh > 97.109.27.104.50034: Flags [P.], seq 13241856:13242020, ack 6913, win 501, length 164
20:23:07.448906 IP 165.227.37.88.ssh > 97.109.27.104.50034: Flags [P.], seq 13242020:13242184, ack 6913, win 501, length 164
20:23:07.448996 IP 165.227.37.88.ssh > 97.109.27.104.50034: Flags [P.], seq 13242184:13242348, ack 6913, win 501, length 164
20:23:07.449080 IP 165.227.37.88.ssh > 97.109.27.104.50034: Flags [P.], seq 13242348:13242512, ack 6913, win 501, length 164
20:23:07.449166 IP 165.227.37.88.ssh > 97.109.27.104.50034: Flags [P.], seq 13242512:13242676, ack 6913, win 501, length 164
20:23:07.449294 IP 165.227.37.88.ssh > 97.109.27.104.50034: Flags [P.], seq 13242676:13242840, ack 6913, win 501, length 164
20:23:07.449410 IP 165.227.37.88.ssh > 97.109.27.104.50034: Flags [P.], seq 13242840:13243004, ack 6913, win 501, length 164
20:23:07.449504 IP 165.227.37.88.ssh > 97.109.27.104.50034: Flags [P.], seq 13243004:13243168, ack 6913, win 501, length 164
20:23:07.449599 IP 165.227.37.88.ssh > 97.109.27.104.50034: Flags [P.], seq 13243168:13243332, ack 6913, win 501, length 164
20:23:07.449689 IP 165.227.37.88.ssh > 97.109.27.104.50034: Flags [P.], seq 13243332:13243496, ack 6913, win 501, length 164
20:23:07.449786 IP 165.227.37.88.ssh > 97.109.27.104.50034: Flags [P.], seq 13243496:13243660, ack 6913, win 501, length 164
20:23:07.449877 IP 165.227.37.88.ssh > 97.109.27.104.50034: Flags [P.], seq 13243660:13243824, ack 6913, win 501, length 164
20:23:07.449965 IP 165.227.37.88.ssh > 97.109.27.104.50034: Flags [P.], seq 13243824:13243988, ack 6913, win 501, length 164
20:23:07.450062 IP 165.227.37.88.ssh > 97.109.27.104.50034: Flags [P.], seq 13243988:13244152, ack 6913, win 501, length 164
20:23:07.450158 IP 165.227.37.88.ssh > 97.109.27.104.50034: Flags [P.], seq 13244152:13244316, ack 6913, win 501, length 164
20:23:07.450250 IP 165.227.37.88.ssh > 97.109.27.104.50034: Flags [P.], seq 13244316:13244480, ack 6913, win 501, length 164
20:23:07.450338 IP 165.227.37.88.ssh > 97.109.27.104.50034: Flags [P.], seq 13244480:13244644, ack 6913, win 501, length 164
20:23:07.450424 IP 165.227.37.88.ssh > 97.109.27.104.50034: Flags [P.], seq 13244644:13244808, ack 6913, win 501, length 164
20:23:07.450510 IP 165.227.37.88.ssh > 97.109.27.104.50034: Flags [P.], seq 13244808:13244972, ack 6913, win 501, length 164
20:23:07.450592 IP 165.227.37.88.ssh > 97.109.27.104.50034: Flags [P.], seq 13244972:13245136, ack 6913, win 501, length 164
20:23:07.450673 IP 165.227.37.88.ssh > 97.109.27.104.50034: Flags [P.], seq 13245136:13245300, ack 6913, win 501, length 164
20:23:07.450757 IP 165.227.37.88.ssh > 97.109.27.104.50034: Flags [P.], seq 13245300:13245464, ack 6913, win 501, length 164
20:23:07.450840 IP 165.227.37.88.ssh > 97.109.27.104.50034: Flags [P.], seq 13245464:13245628, ack 6913, win 501, length 164
20:23:07.450920 IP 165.227.37.88.ssh > 97.109.27.104.50034: Flags [P.], seq 13245628:13245792, ack 6913, win 501, length 164
20:23:07.451003 IP 165.227.37.88.ssh > 97.109.27.104.50034: Flags [P.], seq 13245792:13245956, ack 6913, win 501, length 164
20:23:07.451096 IP 165.227.37.88.ssh > 97.109.27.104.50034: Flags [P.], seq 13245956:13246120, ack 6913, win 501, length 164
20:23:07.451181 IP 165.227.37.88.ssh > 97.109.27.104.50034: Flags [P.], seq 13246120:13246284, ack 6913, win 501, length 164
20:23:07.451259 IP 165.227.37.88.ssh > 97.109.27.104.50034: Flags [P.], seq 13246284:13246448, ack 6913, win 501, length 164
20:23:07.451334 IP 165.227.37.88.ssh > 97.109.27.104.50034: Flags [P.], seq 13246448:13246612, ack 6913, win 501, length 164
20:23:07.451410 IP 165.227.37.88.ssh > 97.109.27.104.50034: Flags [P.], seq 13246612:13246776, ack 6913, win 501, length 164
20:23:07.451504 IP 165.227.37.88.ssh > 97.109.27.104.50034: Flags [P.], seq 13246776:13246940, ack 6913, win 501, length 164
20:23:07.451597 IP 165.227.37.88.ssh > 97.109.27.104.50034: Flags [P.], seq 13246940:13247104, ack 6913, win 501, length 164
20:23:07.451698 IP 165.227.37.88.ssh > 97.109.27.104.50034: Flags [P.], seq 13247104:13247268, ack 6913, win 501, length 164
20:23:07.451788 IP 165.227.37.88.ssh > 97.109.27.104.50034: Flags [P.], seq 13247268:13247432, ack 6913, win 501, length 164
20:23:07.451877 IP 165.227.37.88.ssh > 97.109.27.104.50034: Flags [P.], seq 13247432:13247596, ack 6913, win 501, length 164
20:23:07.451962 IP 165.227.37.88.ssh > 97.109.27.104.50034: Flags [P.], seq 13247596:13247760, ack 6913, win 501, length 164
20:23:07.452044 IP 165.227.37.88.ssh > 97.109.27.104.50034: Flags [P.], seq 13247760:13247924, ack 6913, win 501, length 164
20:23:07.452127 IP 165.227.37.88.ssh > 97.109.27.104.50034: Flags [P.], seq 13247924:13248088, ack 6913, win 501, length 164
20:23:07.452219 IP 165.227.37.88.ssh > 97.109.27.104.50034: Flags [P.], seq 13248088:13248252, ack 6913, win 501, length 164
20:23:07.452303 IP 165.227.37.88.ssh > 97.109.27.104.50034: Flags [P.], seq 13248252:13248416, ack 6913, win 501, length 164
20:23:07.452392 IP 165.227.37.88.ssh > 97.109.27.104.50034: Flags [P.], seq 13248416:13248580, ack 6913, win 501, length 164
20:23:07.452527 IP 165.227.37.88.ssh > 97.109.27.104.50034: Flags [P.], seq 13248580:13248744, ack 6913, win 501, length 164
20:23:07.452696 IP 165.227.37.88.ssh > 97.109.27.104.50034: Flags [P.], seq 13248744:13248908, ack 6913, win 501, length 164
20:23:07.452801 IP 165.227.37.88.ssh > 97.109.27.104.50034: Flags [P.], seq 13248908:13249072, ack 6913, win 501, length 164
20:23:07.452884 IP 165.227.37.88.ssh > 97.109.27.104.50034: Flags [P.], seq 13249072:13249236, ack 6913, win 501, length 164
20:23:07.452968 IP 165.227.37.88.ssh > 97.109.27.104.50034: Flags [P.], seq 13249236:13249400, ack 6913, win 501, length 164
20:23:07.453054 IP 165.227.37.88.ssh > 97.109.27.104.50034: Flags [P.], seq 13249400:13249564, ack 6913, win 501, length 164
20:23:07.453153 IP 165.227.37.88.ssh > 97.109.27.104.50034: Flags [P.], seq 13249564:13249728, ack 6913, win 501, length 164
20:23:07.453284 IP 165.227.37.88.ssh > 97.109.27.104.50034: Flags [P.], seq 13249728:13249892, ack 6913, win 501, length 164
20:23:07.453397 IP 165.227.37.88.ssh > 97.109.27.104.50034: Flags [P.], seq 13249892:13250056, ack 6913, win 501, length 164
20:23:07.453494 IP 165.227.37.88.ssh > 97.109.27.104.50034: Flags [P.], seq 13250056:13250220, ack 6913, win 501, length 164
20:23:07.453585 IP 165.227.37.88.ssh > 97.109.27.104.50034: Flags [P.], seq 13250220:13250384, ack 6913, win 501, length 164
20:23:07.453675 IP 165.227.37.88.ssh > 97.109.27.104.50034: Flags [P.], seq 13250384:13250548, ack 6913, win 501, length 164
20:23:07.453766 IP 165.227.37.88.ssh > 97.109.27.104.50034: Flags [P.], seq 13250548:13250712, ack 6913, win 501, length 164
20:23:07.453865 IP 165.227.37.88.ssh > 97.109.27.104.50034: Flags [P.], seq 13250712:13250876, ack 6913, win 501, length 164
20:23:07.453961 IP 165.227.37.88.ssh > 97.109.27.104.50034: Flags [P.], seq 13250876:13251040, ack 6913, win 501, length 164
20:23:07.454057 IP 165.227.37.88.ssh > 97.109.27.104.50034: Flags [P.], seq 13251040:13251204, ack 6913, win 501, length 164
20:23:07.454151 IP 165.227.37.88.ssh > 97.109.27.104.50034: Flags [P.], seq 13251204:13251368, ack 6913, win 501, length 164
20:23:07.454248 IP 165.227.37.88.ssh > 97.109.27.104.50034: Flags [P.], seq 13251368:13251532, ack 6913, win 501, length 164
20:23:07.454331 IP 165.227.37.88.ssh > 97.109.27.104.50034: Flags [P.], seq 13251532:13251696, ack 6913, win 501, length 164
20:23:07.454412 IP 165.227.37.88.ssh > 97.109.27.104.50034: Flags [P.], seq 13251696:13251860, ack 6913, win 501, length 164
20:23:07.454494 IP 165.227.37.88.ssh > 97.109.27.104.50034: Flags [P.], seq 13251860:13252024, ack 6913, win 501, length 164
20:23:07.454573 IP 165.227.37.88.ssh > 97.109.27.104.50034: Flags [P.], seq 13252024:13252188, ack 6913, win 501, length 164
20:23:07.454665 IP 165.227.37.88.ssh > 97.109.27.104.50034: Flags [P.], seq 13252188:13252352, ack 6913, win 501, length 164
20:23:07.454748 IP 165.227.37.88.ssh > 97.109.27.104.50034: Flags [P.], seq 13252352:13252516, ack 6913, win 501, length 164
20:23:07.454826 IP 165.227.37.88.ssh > 97.109.27.104.50034: Flags [P.], seq 13252516:13252680, ack 6913, win 501, length 164
20:23:07.454914 IP 165.227.37.88.ssh > 97.109.27.104.50034: Flags [P.], seq 13252680:13252844, ack 6913, win 501, length 164
20:23:07.454996 IP 165.227.37.88.ssh > 97.109.27.104.50034: Flags [P.], seq 13252844:13253008, ack 6913, win 501, length 164
20:23:07.455059 IP 97.109.27.104.50034 > 165.227.37.88.ssh: Flags [.], ack 13179268, win 513, length 0
20:23:07.455084 IP 97.109.27.104.50034 > 165.227.37.88.ssh: Flags [.], ack 13184024, win 495, length 0
20:23:07.455199 IP 165.227.37.88.ssh > 97.109.27.104.50034: Flags [P.], seq 13253008:13253380, ack 6913, win 501, length 372
20:23:07.455296 IP 165.227.37.88.ssh > 97.109.27.104.50034: Flags [P.], seq 13253380:13253544, ack 6913, win 501, length 164
20:23:07.455379 IP 165.227.37.88.ssh > 97.109.27.104.50034: Flags [P.], seq 13253544:13253708, ack 6913, win 501, length 164
20:23:07.455462 IP 165.227.37.88.ssh > 97.109.27.104.50034: Flags [P.], seq 13253708:13253872, ack 6913, win 501, length 164
20:23:07.455541 IP 165.227.37.88.ssh > 97.109.27.104.50034: Flags [P.], seq 13253872:13254036, ack 6913, win 501, length 164
20:23:07.455652 IP 165.227.37.88.ssh > 97.109.27.104.50034: Flags [P.], seq 13254036:13254200, ack 6913, win 501, length 164
20:23:07.455734 IP 165.227.37.88.ssh > 97.109.27.104.50034: Flags [P.], seq 13254200:13254364, ack 6913, win 501, length 164
20:23:07.455819 IP 165.227.37.88.ssh > 97.109.27.104.50034: Flags [P.], seq 13254364:13254528, ack 6913, win 501, length 164
20:23:07.455907 IP 165.227.37.88.ssh > 97.109.27.104.50034: Flags [P.], seq 13254528:13254692, ack 6913, win 501, length 164
20:23:07.455992 IP 165.227.37.88.ssh > 97.109.27.104.50034: Flags [P.], seq 13254692:13254856, ack 6913, win 501, length 164
20:23:07.456074 IP 165.227.37.88.ssh > 97.109.27.104.50034: Flags [P.], seq 13254856:13255020, ack 6913, win 501, length 164
20:23:07.456153 IP 165.227.37.88.ssh > 97.109.27.104.50034: Flags [P.], seq 13255020:13255184, ack 6913, win 501, length 164
20:23:07.456235 IP 165.227.37.88.ssh > 97.109.27.104.50034: Flags [P.], seq 13255184:13255348, ack 6913, win 501, length 164
20:23:07.456320 IP 165.227.37.88.ssh > 97.109.27.104.50034: Flags [P.], seq 13255348:13255512, ack 6913, win 501, length 164
20:23:07.456397 IP 165.227.37.88.ssh > 97.109.27.104.50034: Flags [P.], seq 13255512:13255676, ack 6913, win 501, length 164
20:23:07.456477 IP 165.227.37.88.ssh > 97.109.27.104.50034: Flags [P.], seq 13255676:13255840, ack 6913, win 501, length 164
20:23:07.456562 IP 165.227.37.88.ssh > 97.109.27.104.50034: Flags [P.], seq 13255840:13256004, ack 6913, win 501, length 164
20:23:07.456645 IP 165.227.37.88.ssh > 97.109.27.104.50034: Flags [P.], seq 13256004:13256168, ack 6913, win 501, length 164
20:23:07.456727 IP 165.227.37.88.ssh > 97.109.27.104.50034: Flags [P.], seq 13256168:13256332, ack 6913, win 501, length 164
20:23:07.456808 IP 165.227.37.88.ssh > 97.109.27.104.50034: Flags [P.], seq 13256332:13256496, ack 6913, win 501, length 164
20:23:07.456890 IP 165.227.37.88.ssh > 97.109.27.104.50034: Flags [P.], seq 13256496:13256660, ack 6913, win 501, length 164
20:23:07.456969 IP 165.227.37.88.ssh > 97.109.27.104.50034: Flags [P.], seq 13256660:13256824, ack 6913, win 501, length 164
20:23:07.457057 IP 165.227.37.88.ssh > 97.109.27.104.50034: Flags [P.], seq 13256824:13256988, ack 6913, win 501, length 164
20:23:07.457147 IP 165.227.37.88.ssh > 97.109.27.104.50034: Flags [P.], seq 13256988:13257152, ack 6913, win 501, length 164
20:23:07.457274 IP 165.227.37.88.ssh > 97.109.27.104.50034: Flags [P.], seq 13257152:13257316, ack 6913, win 501, length 164
20:23:07.457362 IP 165.227.37.88.ssh > 97.109.27.104.50034: Flags [P.], seq 13257316:13257480, ack 6913, win 501, length 164
20:23:07.457460 IP 165.227.37.88.ssh > 97.109.27.104.50034: Flags [P.], seq 13257480:13257644, ack 6913, win 501, length 164
20:23:07.457544 IP 165.227.37.88.ssh > 97.109.27.104.50034: Flags [P.], seq 13257644:13257808, ack 6913, win 501, length 164
20:23:07.457627 IP 165.227.37.88.ssh > 97.109.27.104.50034: Flags [P.], seq 13257808:13257972, ack 6913, win 501, length 164
20:23:07.457712 IP 165.227.37.88.ssh > 97.109.27.104.50034: Flags [P.], seq 13257972:13258136, ack 6913, win 501, length 164
20:23:07.457791 IP 165.227.37.88.ssh > 97.109.27.104.50034: Flags [P.], seq 13258136:13258300, ack 6913, win 501, length 164
20:23:07.457875 IP 165.227.37.88.ssh > 97.109.27.104.50034: Flags [P.], seq 13258300:13258464, ack 6913, win 501, length 164
20:23:07.457968 IP 165.227.37.88.ssh > 97.109.27.104.50034: Flags [P.], seq 13258464:13258628, ack 6913, win 501, length 164
20:23:07.458059 IP 97.109.27.104.50034 > 165.227.37.88.ssh: Flags [.], ack 13184188, win 494, length 0
20:23:07.458082 IP 97.109.27.104.50034 > 165.227.37.88.ssh: Flags [.], ack 13192252, win 463, length 0
20:23:07.458200 IP 165.227.37.88.ssh > 97.109.27.104.50034: Flags [P.], seq 13258628:13259000, ack 6913, win 501, length 372
20:23:07.458296 IP 165.227.37.88.ssh > 97.109.27.104.50034: Flags [P.], seq 13259000:13259164, ack 6913, win 501, length 164
20:23:07.458383 IP 165.227.37.88.ssh > 97.109.27.104.50034: Flags [P.], seq 13259164:13259328, ack 6913, win 501, length 164
20:23:07.458472 IP 165.227.37.88.ssh > 97.109.27.104.50034: Flags [P.], seq 13259328:13259492, ack 6913, win 501, length 164
20:23:07.458561 IP 165.227.37.88.ssh > 97.109.27.104.50034: Flags [P.], seq 13259492:13259656, ack 6913, win 501, length 164
20:23:07.458653 IP 165.227.37.88.ssh > 97.109.27.104.50034: Flags [P.], seq 13259656:13259820, ack 6913, win 501, length 164
20:23:07.458742 IP 165.227.37.88.ssh > 97.109.27.104.50034: Flags [P.], seq 13259820:13259984, ack 6913, win 501, length 164
20:23:07.458848 IP 165.227.37.88.ssh > 97.109.27.104.50034: Flags [P.], seq 13259984:13260148, ack 6913, win 501, length 164
20:23:07.458937 IP 165.227.37.88.ssh > 97.109.27.104.50034: Flags [P.], seq 13260148:13260312, ack 6913, win 501, length 164
20:23:07.459032 IP 165.227.37.88.ssh > 97.109.27.104.50034: Flags [P.], seq 13260312:13260476, ack 6913, win 501, length 164
20:23:07.459124 IP 165.227.37.88.ssh > 97.109.27.104.50034: Flags [P.], seq 13260476:13260640, ack 6913, win 501, length 164
20:23:07.459227 IP 165.227.37.88.ssh > 97.109.27.104.50034: Flags [P.], seq 13260640:13260804, ack 6913, win 501, length 164
20:23:07.459321 IP 165.227.37.88.ssh > 97.109.27.104.50034: Flags [P.], seq 13260804:13260968, ack 6913, win 501, length 164
20:23:07.459416 IP 165.227.37.88.ssh > 97.109.27.104.50034: Flags [P.], seq 13260968:13261132, ack 6913, win 501, length 164
20:23:07.459510 IP 165.227.37.88.ssh > 97.109.27.104.50034: Flags [P.], seq 13261132:13261296, ack 6913, win 501, length 164
20:23:07.459596 IP 165.227.37.88.ssh > 97.109.27.104.50034: Flags [P.], seq 13261296:13261460, ack 6913, win 501, length 164
20:23:07.459683 IP 165.227.37.88.ssh > 97.109.27.104.50034: Flags [P.], seq 13261460:13261624, ack 6913, win 501, length 164
20:23:07.459763 IP 165.227.37.88.ssh > 97.109.27.104.50034: Flags [P.], seq 13261624:13261788, ack 6913, win 501, length 164
