20:33:53.107041 IP 165.227.37.88.ssh > 97.109.27.104.50034: Flags [P.], seq 749024:749180, ack 397, win 501, length 156
20:33:53.107133 IP 165.227.37.88.ssh > 97.109.27.104.50034: Flags [P.], seq 749180:749336, ack 397, win 501, length 156
20:33:53.107201 IP 165.227.37.88.ssh > 97.109.27.104.50034: Flags [P.], seq 749336:749492, ack 397, win 501, length 156
20:33:53.107259 IP 165.227.37.88.ssh > 97.109.27.104.50034: Flags [P.], seq 749492:749648, ack 397, win 501, length 156
20:33:53.107312 IP 165.227.37.88.ssh > 97.109.27.104.50034: Flags [P.], seq 749648:749804, ack 397, win 501, length 156
20:33:53.107365 IP 165.227.37.88.ssh > 97.109.27.104.50034: Flags [P.], seq 749804:749960, ack 397, win 501, length 156
20:33:53.107432 IP 165.227.37.88.ssh > 97.109.27.104.50034: Flags [P.], seq 749960:750116, ack 397, win 501, length 156
20:33:53.107529 IP 165.227.37.88.ssh > 97.109.27.104.50034: Flags [P.], seq 750116:750272, ack 397, win 501, length 156
20:33:53.107604 IP 165.227.37.88.ssh > 97.109.27.104.50034: Flags [P.], seq 750272:750428, ack 397, win 501, length 156
20:33:53.107697 IP 165.227.37.88.ssh > 97.109.27.104.50034: Flags [P.], seq 750428:750584, ack 397, win 501, length 156
20:33:53.107760 IP 165.227.37.88.ssh > 97.109.27.104.50034: Flags [P.], seq 750584:750740, ack 397, win 501, length 156
20:33:53.107814 IP 165.227.37.88.ssh > 97.109.27.104.50034: Flags [P.], seq 750740:750896, ack 397, win 501, length 156
20:33:53.107868 IP 165.227.37.88.ssh > 97.109.27.104.50034: Flags [P.], seq 750896:751052, ack 397, win 501, length 156
20:33:53.107925 IP 165.227.37.88.ssh > 97.109.27.104.50034: Flags [P.], seq 751052:751208, ack 397, win 501, length 156
20:33:53.107978 IP 165.227.37.88.ssh > 97.109.27.104.50034: Flags [P.], seq 751208:751364, ack 397, win 501, length 156
20:33:53.108049 IP 165.227.37.88.ssh > 97.109.27.104.50034: Flags [P.], seq 751364:751520, ack 397, win 501, length 156
20:33:53.108139 IP 165.227.37.88.ssh > 97.109.27.104.50034: Flags [P.], seq 751520:751676, ack 397, win 501, length 156
20:33:53.108202 IP 165.227.37.88.ssh > 97.109.27.104.50034: Flags [P.], seq 751676:751832, ack 397, win 501, length 156
20:33:53.108255 IP 165.227.37.88.ssh > 97.109.27.104.50034: Flags [P.], seq 751832:751988, ack 397, win 501, length 156
20:33:53.108311 IP 165.227.37.88.ssh > 97.109.27.104.50034: Flags [P.], seq 751988:752144, ack 397, win 501, length 156
20:33:53.108365 IP 165.227.37.88.ssh > 97.109.27.104.50034: Flags [P.], seq 752144:752300, ack 397, win 501, length 156
20:33:53.108418 IP 165.227.37.88.ssh > 97.109.27.104.50034: Flags [P.], seq 752300:752456, ack 397, win 501, length 156
20:33:53.108475 IP 165.227.37.88.ssh > 97.109.27.104.50034: Flags [P.], seq 752456:752612, ack 397, win 501, length 156
20:33:53.108529 IP 165.227.37.88.ssh > 97.109.27.104.50034: Flags [P.], seq 752612:752768, ack 397, win 501, length 156
20:33:53.108585 IP 165.227.37.88.ssh > 97.109.27.104.50034: Flags [P.], seq 752768:752924, ack 397, win 501, length 156
20:33:53.108637 IP 165.227.37.88.ssh > 97.109.27.104.50034: Flags [P.], seq 752924:753080, ack 397, win 501, length 156
20:33:53.108691 IP 165.227.37.88.ssh > 97.109.27.104.50034: Flags [P.], seq 753080:753236, ack 397, win 501, length 156
20:33:53.108756 IP 165.227.37.88.ssh > 97.109.27.104.50034: Flags [P.], seq 753236:753392, ack 397, win 501, length 156
20:33:53.108808 IP 165.227.37.88.ssh > 97.109.27.104.50034: Flags [P.], seq 753392:753548, ack 397, win 501, length 156
20:33:53.108872 IP 165.227.37.88.ssh > 97.109.27.104.50034: Flags [P.], seq 753548:753704, ack 397, win 501, length 156
20:33:53.108929 IP 165.227.37.88.ssh > 97.109.27.104.50034: Flags [P.], seq 753704:753860, ack 397, win 501, length 156
20:33:53.109014 IP 165.227.37.88.ssh > 97.109.27.104.50034: Flags [P.], seq 753860:754016, ack 397, win 501, length 156
20:33:53.110764 IP 97.109.27.104.50034 > 165.227.37.88.ssh: Flags [P.], seq 397:433, ack 708800, win 514, length 36
20:33:53.110854 IP 165.227.37.88.ssh > 97.109.27.104.50034: Flags [.], ack 433, win 501, length 0
^C
4947 packets captured
4948 packets received by filter
0 packets dropped by kernel
root@lamp-ubuntu-s-1vcpu-1gb-tor1-01:~#
